Question,Job Title,Job Description,Similarity Score
what are vuex getters,Software Engineer,Take responsibility for software craftsmanship and mentoring others in modern engineering practices.,0
what is a property style access,Software Engineer,Work on full-stack solutions or system-level integrations as part of agile engineering teams.,0
what is a method style access,Software Engineer,Take responsibility for software craftsmanship and mentoring others in modern engineering practices.,0
what is mapgetter helper,Software Engineer,"Own technical delivery of features, writing efficient and reusable code across service layers.",0
what are mutations,Software Engineer,"Own technical delivery of features, writing efficient and reusable code across service layers.",0
how do you commit with payload,Software Engineer,"Own technical delivery of features, writing efficient and reusable code across service layers.",0
what is object style commit,Software Engineer,Work on full-stack solutions or system-level integrations as part of agile engineering teams.,0.300690424
what are the caveats with vuex mutations,Software Engineer,"Engage in peer reviews, architecture discussions, and performance tuning of deployed systems.",0
why mutations should be synchronous,Software Engineer,"Engage in peer reviews, architecture discussions, and performance tuning of deployed systems.",0
how do you perform mutations in components,Quality Assurance (QA) Engineer,"We’re looking for a Quality Assurance (QA) Engineer to design scalable, robust systems and contribute to technical planning.",0.251484411
is it mandatory to use constants for mutation types,Quality Assurance (QA) Engineer,"We’re looking for a Quality Assurance (QA) Engineer to design scalable, robust systems and contribute to technical planning.",0.319458468
how do you perform asynchronous operations,Quality Assurance (QA) Engineer,"We’re looking for a Quality Assurance (QA) Engineer to design scalable, robust systems and contribute to technical planning.",0.315643234
what are differences between mutations and actions,Software Engineer,"Build and evolve complex systems using best practices in design patterns, testing, and deployment.",0
give an example usage of actions,Software Engineer,"Engage in peer reviews, architecture discussions, and performance tuning of deployed systems.",0.302373554
how do you dispatch actions,Software Engineer,"Engage in peer reviews, architecture discussions, and performance tuning of deployed systems.",0
can you dispatch an action using payload or object,Software Engineer,Work on full-stack solutions or system-level integrations as part of agile engineering teams.,0.264121704
can i use styled components in vuejs,Frontend Developer,Ensure accessibility compliance and cross-platform support in all UI implementations.,0.25783271
how do you dispatch actions in components,Frontend Developer,Bridge product design with frontend logic to create intuitive user journeys and responsive views.,0.295777502
how do you compose actions,Software Engineer,"Build and evolve complex systems using best practices in design patterns, testing, and deployment.",0
what are modules in vuex,Software Engineer,Work on full-stack solutions or system-level integrations as part of agile engineering teams.,0
what is module local state,Object-Oriented Developer,The Object-Oriented Developer in this position will work on real-world challenges using collaborative software practices.,0.311712343
what is namespacing in vuex,Software Engineer,"Build and evolve complex systems using best practices in design patterns, testing, and deployment.",0
what is the default namespace behavior in vuex,Software Engineer,Work on full-stack solutions or system-level integrations as part of agile engineering teams.,0
when do you reuse modules,Software Engineer,Work on full-stack solutions or system-level integrations as part of agile engineering teams.,0
what are the principles enforced by vuex,Software Engineer,"Engage in peer reviews, architecture discussions, and performance tuning of deployed systems.",0.274907195
can i perform mutations directly in strict mode,Quality Assurance (QA) Engineer,The Quality Assurance (QA) Engineer in this position will work on real-world challenges using collaborative software practices.,0.315643234
how to use model directive with two way computed property,Machine Learning Engineer,"We’re looking for a Machine Learning Engineer to design scalable, robust systems and contribute to technical planning.",0.280886176
what is vue cli,Frontend Developer,"Create seamless web experiences through component-based development, animations, and design fidelity.",0.310260936
what are the features provided by vue cli,Frontend Developer,"Create seamless web experiences through component-based development, animations, and design fidelity.",0.310260936
what is instant prototyping,Software Engineer,Take responsibility for software craftsmanship and mentoring others in modern engineering practices.,0
how do you create project using vue cli,Full-Stack Developer,"We’re looking for a Full-Stack Developer to design scalable, robust systems and contribute to technical planning.",0.233358005
how do you create project using gui,Full-Stack Developer,"We’re looking for a Full-Stack Developer to design scalable, robust systems and contribute to technical planning.",0.332581445
what are plugins in vue cli,Frontend Developer,Leverage component libraries and testing tools to develop scalable frontend applications.,0.310260936
how do you install plugins in an existing vue cli project,Frontend Developer,"Create seamless web experiences through component-based development, animations, and design fidelity.",0.310260936
how to access local plugins in a project,Software Engineer,"Engage in peer reviews, architecture discussions, and performance tuning of deployed systems.",0
how do you create ui plugins kind of behavior,Frontend Developer,Integrate frontend services with REST or GraphQL APIs for dynamic data rendering.,0.195069816
what are presets,Software Engineer,Take responsibility for software craftsmanship and mentoring others in modern engineering practices.,0
what is the versioning behavior in preset plugins,Software Engineer,Take responsibility for software craftsmanship and mentoring others in modern engineering practices.,0
how do you allow plugin prompts,Software Engineer,Take responsibility for software craftsmanship and mentoring others in modern engineering practices.,0
what are remote presets,Software Engineer,Work on full-stack solutions or system-level integrations as part of agile engineering teams.,0
can i use local presets,Backend Developer,"Write automated tests, profiling tools, and observability hooks into backend systems.",0.217125148
what is the purpose of browserslist option,Software Engineer,Work on full-stack solutions or system-level integrations as part of agile engineering teams.,0
how do you find vuejs version using api,Backend Developer,"Develop high-reliability systems using background jobs, event queues, and caching mechanisms.",0.293920591
how do you create reactive objects,Frontend Developer,Integrate frontend services with REST or GraphQL APIs for dynamic data rendering.,0.195069816
what is the purpose new slot directive,Software Engineer,Take responsibility for software craftsmanship and mentoring others in modern engineering practices.,0
what is the use of compile method,Backend Developer,"Develop high-reliability systems using background jobs, event queues, and caching mechanisms.",0.217125148
what does nexttick do in vuejs,Software Engineer,"Own technical delivery of features, writing efficient and reusable code across service layers.",0
what is async error handling,Backend Developer,"Develop high-reliability systems using background jobs, event queues, and caching mechanisms.",0.283462078
what are dynamic directive arguments,Frontend Developer,Integrate frontend services with REST or GraphQL APIs for dynamic data rendering.,0.285316836
what are the drawbacks of dynamic directive arguments,Frontend Developer,Integrate frontend services with REST or GraphQL APIs for dynamic data rendering.,0.285316836
what is the special handling for null values in dynamic directive arguments,Backend Developer,"Collaborate across engineering and DevOps teams to monitor, optimize, and secure services.",0.216351209
can i use dynamic directive null value for slots,System Architect,"We’re looking for a System Architect to design scalable, robust systems and contribute to technical planning.",0.231477177
what is vue i18n plugin,Frontend Developer,Integrate frontend services with REST or GraphQL APIs for dynamic data rendering.,0.310260936
what are the types of formatting,Quality Assurance (QA) Engineer,"We’re looking for a Quality Assurance (QA) Engineer to design scalable, robust systems and contribute to technical planning.",0.345214945
what is custom formatting,Software Engineer,Take responsibility for software craftsmanship and mentoring others in modern engineering practices.,0
how do you handle pluralization,Full-Stack Developer,"We’re looking for a Full-Stack Developer to design scalable, robust systems and contribute to technical planning.",0.195867314
how to implement datetime localization,Backend Developer,"Develop high-reliability systems using background jobs, event queues, and caching mechanisms.",0.184507608
how do you implement number localization,Backend Developer,"Write automated tests, profiling tools, and observability hooks into backend systems.",0.184507608
how do you perform locale changing,Quality Assurance (QA) Engineer,The Quality Assurance (QA) Engineer in this position will work on real-world challenges using collaborative software practices.,0.315643234
what is lazy loading translations,Frontend Developer,Ensure accessibility compliance and cross-platform support in all UI implementations.,0.409455714
what is the main difference between method and computed property,Software Engineer,Take responsibility for software craftsmanship and mentoring others in modern engineering practices.,0
what is vuetify,Software Engineer,Take responsibility for software craftsmanship and mentoring others in modern engineering practices.,0
how do you watch for nested data changes,Data Engineer,"Establish data validation, lineage tracking, and quality monitoring for trusted datasets.",0.53286123
how to trigger watchers on initialization,Software Engineer,"Engage in peer reviews, architecture discussions, and performance tuning of deployed systems.",0
what is the purpose of comments option,Software Engineer,Take responsibility for software craftsmanship and mentoring others in modern engineering practices.,0
how to identify whether code is running on client or server,Full-Stack Developer,The Full-Stack Developer in this position will work on real-world challenges using collaborative software practices.,0.216058447
how do you watch route object changes,Software Engineer,"Build and evolve complex systems using best practices in design patterns, testing, and deployment.",0.300690424
how do you sync current route in vuex store,Software Engineer,"Engage in peer reviews, architecture discussions, and performance tuning of deployed systems.",0
what are navigation guards in vue router,Frontend Developer,Integrate frontend services with REST or GraphQL APIs for dynamic data rendering.,0.310260936
can i use computed property in another computed property,Backend Developer,"Design with failure recovery, concurrency, and throughput in mind to support global applications.",0.217125148
how can i use imported constant in template section,Backend Developer,Build scalable APIs and backend modules that interface with storage layers and external services.,0.217125148
is recommended to use async for computed properties,Backend Developer,Build scalable APIs and backend modules that interface with storage layers and external services.,0.217125148
what happens if you use duplicate field names,Backend Developer,"Design with failure recovery, concurrency, and throughput in mind to support global applications.",0.217125148
why the component data must be a function,Data Engineer,"Establish data validation, lineage tracking, and quality monitoring for trusted datasets.",0.53286123
what is the reason for recommendation for multiword component names,System Architect,"We’re looking for a System Architect to design scalable, robust systems and contribute to technical planning.",0.34331501
how to use composition api in vue20,Backend Developer,"Develop high-reliability systems using background jobs, event queues, and caching mechanisms.",0.319023582
what is composition api,Backend Developer,"Write automated tests, profiling tools, and observability hooks into backend systems.",0.361434331
what is the best way to rerender a component,Software Engineer,"Build and evolve complex systems using best practices in design patterns, testing, and deployment.",0
what is react,Frontend Developer,Bridge product design with frontend logic to create intuitive user journeys and responsive views.,0.252374459
what are the major features of react,Frontend Developer,Bridge product design with frontend logic to create intuitive user journeys and responsive views.,0.252374459
what is jsx,Software Engineer,Work on full-stack solutions or system-level integrations as part of agile engineering teams.,0
what is the difference between element and component,Software Engineer,"Build and evolve complex systems using best practices in design patterns, testing, and deployment.",0
how to create components in react,Frontend Developer,Leverage component libraries and testing tools to develop scalable frontend applications.,0.401281211
when to use a class component over a function component,Backend Developer,"Develop high-reliability systems using background jobs, event queues, and caching mechanisms.",0.217125148
what are pure components,Frontend Developer,Bridge product design with frontend logic to create intuitive user journeys and responsive views.,0.295777502
what is state in react,Object-Oriented Developer,The Object-Oriented Developer in this position will work on real-world challenges using collaborative software practices.,0.248099395
what are props in react,Frontend Developer,"Create seamless web experiences through component-based development, animations, and design fidelity.",0.252374459
what is the difference between state and props,Object-Oriented Developer,The Object-Oriented Developer in this position will work on real-world challenges using collaborative software practices.,0.311712343
why should we not update the state directly,Object-Oriented Developer,"We’re looking for a Object-Oriented Developer to design scalable, robust systems and contribute to technical planning.",0.311712343
what is the purpose of callback function as an argument of setstate,Software Engineer,"Engage in peer reviews, architecture discussions, and performance tuning of deployed systems.",0
what is the difference between html and react event handling,Frontend Developer,Ensure accessibility compliance and cross-platform support in all UI implementations.,0.193429336
how to bind methods or event handlers in jsx callbacks,Quality Assurance (QA) Engineer,The Quality Assurance (QA) Engineer in this position will work on real-world challenges using collaborative software practices.,0.256454065
how to pass a parameter to an event handler or callback,Frontend Developer,Leverage component libraries and testing tools to develop scalable frontend applications.,0.325790855
what are synthetic events in react,Frontend Developer,Integrate frontend services with REST or GraphQL APIs for dynamic data rendering.,0.285963567
what are inline conditional expressions,Software Engineer,Work on full-stack solutions or system-level integrations as part of agile engineering teams.,0
what is key prop and what is the benefit of using it in arrays of elements,System Architect,The System Architect in this position will work on real-world challenges using collaborative software practices.,0.19393633
what is the use of refs,Backend Developer,"Develop high-reliability systems using background jobs, event queues, and caching mechanisms.",0.217125148
how to create refs,Frontend Developer,"Create seamless web experiences through component-based development, animations, and design fidelity.",0.195069816
what are forward refs,Software Engineer,Work on full-stack solutions or system-level integrations as part of agile engineering teams.,0
which is preferred option with in callback refs and finddomnode,Software Engineer,Take responsibility for software craftsmanship and mentoring others in modern engineering practices.,0
why are string refs legacy,Software Engineer,"Own technical delivery of features, writing efficient and reusable code across service layers.",0
what is virtual dom,System Architect,The System Architect in this position will work on real-world challenges using collaborative software practices.,0.300321136
how virtual dom works,System Architect,The System Architect in this position will work on real-world challenges using collaborative software practices.,0.300321136
what is the difference between shadow dom and virtual dom,Frontend Developer,"Create seamless web experiences through component-based development, animations, and design fidelity.",0.238891472
what is react fiber,Frontend Developer,"Create seamless web experiences through component-based development, animations, and design fidelity.",0.252374459
what is the main goal of react fiber,Frontend Developer,Ensure accessibility compliance and cross-platform support in all UI implementations.,0.252374459
what are controlled components,Frontend Developer,Leverage component libraries and testing tools to develop scalable frontend applications.,0.295777502
what are uncontrolled components,Frontend Developer,"Create seamless web experiences through component-based development, animations, and design fidelity.",0.295777502
what is the difference between createelement and cloneelement,Software Engineer,Take responsibility for software craftsmanship and mentoring others in modern engineering practices.,0
what is lifting state up in react,Object-Oriented Developer,"We’re looking for a Object-Oriented Developer to design scalable, robust systems and contribute to technical planning.",0.248099395
what are the different phases of component lifecycle,System Architect,The System Architect in this position will work on real-world challenges using collaborative software practices.,0.377735746
what are the lifecycle methods of react,System Architect,The System Architect in this position will work on real-world challenges using collaborative software practices.,0.258915413
what are higherorder components,Frontend Developer,"Create seamless web experiences through component-based development, animations, and design fidelity.",0.295777502
how to create props proxy for hoc component,Frontend Developer,Ensure accessibility compliance and cross-platform support in all UI implementations.,0.195069816
what is context,Software Engineer,"Build and evolve complex systems using best practices in design patterns, testing, and deployment.",0
what is children prop,Software Engineer,Work on full-stack solutions or system-level integrations as part of agile engineering teams.,0
how to write comments in react,Quality Assurance (QA) Engineer,The Quality Assurance (QA) Engineer in this position will work on real-world challenges using collaborative software practices.,0.252522067
what is the purpose of using super constructor with props argument,Full-Stack Developer,The Full-Stack Developer in this position will work on real-world challenges using collaborative software practices.,0.270602917
what is reconciliation,Software Engineer,"Own technical delivery of features, writing efficient and reusable code across service layers.",0
how to set state with a dynamic key name,System Architect,"We’re looking for a System Architect to design scalable, robust systems and contribute to technical planning.",0.200191102
what would be the common mistake of function being called every time the component renders,Data Engineer,"Establish data validation, lineage tracking, and quality monitoring for trusted datasets.",0.271665303
is lazy function supports named exports,Frontend Developer,Leverage component libraries and testing tools to develop scalable frontend applications.,0.298593538
why react uses classname over class attribute,Frontend Developer,Leverage component libraries and testing tools to develop scalable frontend applications.,0.252374459
what are fragments,Software Engineer,Work on full-stack solutions or system-level integrations as part of agile engineering teams.,0
why fragments are better than container divs,Software Engineer,"Engage in peer reviews, architecture discussions, and performance tuning of deployed systems.",0
what are portals in react,Frontend Developer,Bridge product design with frontend logic to create intuitive user journeys and responsive views.,0.252374459
what are stateless components,Frontend Developer,"Create seamless web experiences through component-based development, animations, and design fidelity.",0.295777502
what are stateful components,Frontend Developer,Ensure accessibility compliance and cross-platform support in all UI implementations.,0.295777502
how to apply validation on props in react,Data Engineer,Participate in building internal data platforms that abstract complexity for data scientists.,0.288404835
what are the advantages of react,Frontend Developer,Ensure accessibility compliance and cross-platform support in all UI implementations.,0.252374459
what are the limitations of react,Frontend Developer,Leverage component libraries and testing tools to develop scalable frontend applications.,0.252374459
what are error boundaries in react v16,Frontend Developer,"Create seamless web experiences through component-based development, animations, and design fidelity.",0.252374459
how are error boundaries handled in react v15,Frontend Developer,Leverage component libraries and testing tools to develop scalable frontend applications.,0.252374459
what are the recommended ways for static type checking,Software Engineer,"Engage in peer reviews, architecture discussions, and performance tuning of deployed systems.",0
what is the use of reactdom package,Backend Developer,"Collaborate across engineering and DevOps teams to monitor, optimize, and secure services.",0.217125148
what is the purpose of render method of reactdom,Software Engineer,Take responsibility for software craftsmanship and mentoring others in modern engineering practices.,0
what is reactdomserver,Software Engineer,"Own technical delivery of features, writing efficient and reusable code across service layers.",0
how to use innerhtml in react,Full-Stack Developer,"We’re looking for a Full-Stack Developer to design scalable, robust systems and contribute to technical planning.",0.299825964
how to use styles in react,Full-Stack Developer,"We’re looking for a Full-Stack Developer to design scalable, robust systems and contribute to technical planning.",0.299825964
how events are different in react,Frontend Developer,Leverage component libraries and testing tools to develop scalable frontend applications.,0.285963567
what will happen if you use setstate in constructor,Backend Developer,"Write automated tests, profiling tools, and observability hooks into backend systems.",0.217125148
what is the impact of indexes as keys,Backend Developer,"Collaborate across engineering and DevOps teams to monitor, optimize, and secure services.",0.360257585
is it good to use setstate in componentwillmount method,Backend Developer,"Design with failure recovery, concurrency, and throughput in mind to support global applications.",0.217125148
what will happen if you use props in initial state,Frontend Developer,Bridge product design with frontend logic to create intuitive user journeys and responsive views.,0.350617535
how do you conditionally render components,Frontend Developer,Bridge product design with frontend logic to create intuitive user journeys and responsive views.,0.295777502
why we need to be careful when spreading props on dom elements,Frontend Developer,Bridge product design with frontend logic to create intuitive user journeys and responsive views.,0.302625784
how you use decorators in react,Full-Stack Developer,The Full-Stack Developer in this position will work on real-world challenges using collaborative software practices.,0.299825964
how do you memoize a component,Software Engineer,"Engage in peer reviews, architecture discussions, and performance tuning of deployed systems.",0
how you implement serverside rendering or ssr,Full-Stack Developer,The Full-Stack Developer in this position will work on real-world challenges using collaborative software practices.,0.410491235
how to enable production mode in react,Quality Assurance (QA) Engineer,The Quality Assurance (QA) Engineer in this position will work on real-world challenges using collaborative software practices.,0.315467626
what is cra and its benefits,Software Engineer,"Build and evolve complex systems using best practices in design patterns, testing, and deployment.",0
what is the lifecycle methods order in mounting,System Architect,The System Architect in this position will work on real-world challenges using collaborative software practices.,0.278204182
what are the lifecycle methods going to be deprecated in react v16,System Architect,"We’re looking for a System Architect to design scalable, robust systems and contribute to technical planning.",0.258915413
what is the purpose of getderivedstatefromprops lifecycle method,System Architect,The System Architect in this position will work on real-world challenges using collaborative software practices.,0.377735746
