Question,Job Title,Job Description,Similarity Score
what is the difference between compilation and interpretation,Software Engineer,"Work on mission-critical systems where attention to detail, testing, and maintainable code are essential.",0
explain the concept of polymorphism,Software Engineer,Contribute to the development of enterprise-level applications using modern software engineering principles and best practices.,0.302373554
define encapsulation and give an example,Software Engineer,Join our engineering team to design and implement reliable software systems with a focus on clean architecture and scalable code.,0.33413036
what is an abstract class and how is it different from an interface,Software Engineer,"Develop and maintain backend and frontend components in a collaborative environment, ensuring code quality and reusability.",0.304791417
describe the principles of objectoriented programming oop,Software Engineer,"Work on mission-critical systems where attention to detail, testing, and maintainable code are essential.",0.336024943
what is the purpose of a constructor,Software Engineer,"Develop and maintain backend and frontend components in a collaborative environment, ensuring code quality and reusability.",0
explain the difference between stack and heap memory,Software Engineer,"We're looking for a Software Engineer skilled in problem-solving, debugging, and implementing robust features in production environments.",0.315813371
what is a design pattern and can you name a few,Frontend Developer,Help us build interactive components and maintain a consistent visual experience across our platform.,0.337115178
define the term dry in software development,Software Engineer,"Work on mission-critical systems where attention to detail, testing, and maintainable code are essential.",0.382761279
what is the solid principle,Software Engineer,Join our engineering team to design and implement reliable software systems with a focus on clean architecture and scalable code.,0.304513616
what is the difference between an array and a linked list,System Architect,We're hiring a System Architect to support our technology goals and contribute to technical project success.,0.357429194
explain the time complexity of an algorithm,Data Engineer,Build scalable ETL processes and maintain data infrastructure to support analytics and ML workflows.,0.470329255
describe the difference between a binary search tree and a hash table,Data Engineer,"Collaborate with analysts and scientists to provide clean, structured, and reliable data sources.",0.271017163
what is a linked list and how does it work,System Architect,We're hiring a System Architect to support our technology goals and contribute to technical project success.,0.325421002
explain the concept of recursion,Algorithm Engineer,We're hiring a Algorithm Engineer to support our technology goals and contribute to technical project success.,0.364114786
what is big o notation and why is it important,Data Engineer,"Join our team to design data pipelines and transform raw data into meaningful insights using tools like Spark, Airflow, and SQL.",0.292967023
how do you perform a binary search on a sorted array,Data Engineer,"Join our team to design data pipelines and transform raw data into meaningful insights using tools like Spark, Airflow, and SQL.",0.24593783
discuss the advantages and disadvantages of different sorting algorithms,Data Engineer,Work on real-time and batch data systems using cloud-based platforms and modern data stacks.,0.467626962
explain how a hash table works,Data Engineer,Work on real-time and batch data systems using cloud-based platforms and modern data stacks.,0.272484142
what is dynamic programming,Data Engineer,"We're hiring a Data Engineer to manage large-scale data ingestion, processing, and warehousing solutions.",0.523420087
what is the difference between java and javascript,Backend Developer,"Create and maintain backend infrastructure, RESTful APIs, and support data persistence layers.",0.275945762
describe the mvc architectural pattern,System Architect,We're hiring a System Architect to support our technology goals and contribute to technical project success.,0.31235799
what is a restful api,Backend Developer,"We're hiring a Backend Developer to manage application performance, system integration, and deployment pipelines.",0.274980579
explain the use of this keyword in javascript,Frontend Developer,Join our UI/UX team to deliver accessible and performant web interfaces that scale across devices and browsers.,0.308266822
what is a closure in programming,Data Engineer,"Join our team to design data pipelines and transform raw data into meaningful insights using tools like Spark, Airflow, and SQL.",0.46269921
what are the differences between python 2 and python 3,Backend Developer,"Develop APIs and server-side logic in a scalable and secure architecture using tools like Node.js, Django, or Spring Boot.",0.353598373
discuss the role of a package manager like npm or pip,Software Engineer,Join our engineering team to design and implement reliable software systems with a focus on clean architecture and scalable code.,0.355297034
explain the concept of multithreading in java,Backend Developer,"Develop APIs and server-side logic in a scalable and secure architecture using tools like Node.js, Django, or Spring Boot.",0.260843764
what is a singleton pattern,Backend Developer,"Develop APIs and server-side logic in a scalable and secure architecture using tools like Node.js, Django, or Spring Boot.",0.303976867
what is a virtual function in c,System Architect,We're hiring a System Architect to support our technology goals and contribute to technical project success.,0.36557571
what is a database index and why is it important,Full-Stack Developer,We're hiring a Full-Stack Developer to support our technology goals and contribute to technical project success.,0.415384372
explain the differences between sql and nosql databases,Backend Developer,Build robust systems that handle large-scale data and traffic with reliability and maintainability.,0.253952566
what is a foreign key in a database,Full-Stack Developer,We're hiring a Full-Stack Developer to support our technology goals and contribute to technical project success.,0.270004635
describe the acid properties in database transactions,Backend Developer,"We're hiring a Backend Developer to manage application performance, system integration, and deployment pipelines.",0.298580394
how do you optimize a sql query for better performance,Data Engineer,Work on real-time and batch data systems using cloud-based platforms and modern data stacks.,0.325745764
what is normalization in database design,Full-Stack Developer,We're hiring a Full-Stack Developer to support our technology goals and contribute to technical project success.,0.332715905
explain the difference between inner join and left join in sql,Backend Developer,"Work on microservices, caching, and data layer optimization to support a fast and reliable backend.",0.314034279
what is a stored procedure and when would you use one,Backend Developer,"Develop APIs and server-side logic in a scalable and secure architecture using tools like Node.js, Django, or Spring Boot.",0.340353375
what is database denormalization and when is it appropriate,Full-Stack Developer,We're hiring a Full-Stack Developer to support our technology goals and contribute to technical project success.,0.34163228
discuss the advantages and disadvantages of using an orm tool,Full-Stack Developer,We're hiring a Full-Stack Developer to support our technology goals and contribute to technical project success.,0.270602917
what is the document object model dom,Software Engineer,"Develop and maintain backend and frontend components in a collaborative environment, ensuring code quality and reusability.",0.21024476
explain the difference between http and https,Backend Developer,Build robust systems that handle large-scale data and traffic with reliability and maintainability.,0.351846396
what is cors crossorigin resource sharing,DevOps Engineer,Contribute to site reliability by building tooling and automation for efficient system operations.,0.35773349
describe the purpose of a web server like apache or nginx,Software Engineer,"Develop and maintain backend and frontend components in a collaborative environment, ensuring code quality and reusability.",0.246903903
what is a cookie and how does it work,Frontend Developer,"We're hiring a Frontend Developer to craft responsive user interfaces using modern frameworks like React, Vue, or Angular.",0.233844246
what is a session in web development,Software Engineer,Join our engineering team to design and implement reliable software systems with a focus on clean architecture and scalable code.,0.301030559
explain the concept of responsive web design,Frontend Developer,Work closely with designers and backend engineers to bring engaging and pixel-perfect interfaces to life.,0.482621283
describe the differences between get and post requests,Backend Developer,Build robust systems that handle large-scale data and traffic with reliability and maintainability.,0.351846396
what is the importance of seo in web development,Software Engineer,"We're looking for a Software Engineer skilled in problem-solving, debugging, and implementing robust features in production environments.",0.295448338
how does a web browser render a web page,Frontend Developer,Work closely with designers and backend engineers to bring engaging and pixel-perfect interfaces to life.,0.327191841
what is unit testing and why is it important,Quality Assurance (QA) Engineer,We're hiring a Quality Assurance (QA) Engineer to support our technology goals and contribute to technical project success.,0.398448347
explain the difference between blackbox and whitebox testing,Quality Assurance (QA) Engineer,We're hiring a Quality Assurance (QA) Engineer to support our technology goals and contribute to technical project success.,0.508532169
what is regression testing,Quality Assurance (QA) Engineer,We're hiring a Quality Assurance (QA) Engineer to support our technology goals and contribute to technical project success.,0.439330919
describe the purpose of code reviews,Quality Assurance (QA) Engineer,We're hiring a Quality Assurance (QA) Engineer to support our technology goals and contribute to technical project success.,0.452024794
what is continuous integration ci and continuous delivery cd,Python Developer,We're hiring a Python Developer to support our technology goals and contribute to technical project success.,0.321534242
explain the concept of code coverage in testing,Quality Assurance (QA) Engineer,We're hiring a Quality Assurance (QA) Engineer to support our technology goals and contribute to technical project success.,0.380259137
what is a test case and how do you write one,Quality Assurance (QA) Engineer,We're hiring a Quality Assurance (QA) Engineer to support our technology goals and contribute to technical project success.,0.352888499
what is load testing and why is it necessary,Quality Assurance (QA) Engineer,We're hiring a Quality Assurance (QA) Engineer to support our technology goals and contribute to technical project success.,0.37284991
describe the differences between manual and automated testing,Quality Assurance (QA) Engineer,We're hiring a Quality Assurance (QA) Engineer to support our technology goals and contribute to technical project success.,0.36000398
what is a bug tracking system,Quality Assurance (QA) Engineer,We're hiring a Quality Assurance (QA) Engineer to support our technology goals and contribute to technical project success.,0.427402685
what is git and how does it work,Frontend Developer,Join our UI/UX team to deliver accessible and performant web interfaces that scale across devices and browsers.,0.233844246
explain the difference between git and svn subversion,Software Engineer,"Develop and maintain backend and frontend components in a collaborative environment, ensuring code quality and reusability.",0
what is a merge conflict and how do you resolve it in git,Software Engineer,"Develop and maintain backend and frontend components in a collaborative environment, ensuring code quality and reusability.",0
describe the purpose of branching in version control,Software Engineer,Join our engineering team to design and implement reliable software systems with a focus on clean architecture and scalable code.,0
what is a pull request pr and how does it work,Frontend Developer,"As a Frontend Developer, you'll implement design systems, animations, and optimize page load times.",0.233844246
how do you handle code conflicts in a team project,Algorithm Engineer,We're hiring a Algorithm Engineer to support our technology goals and contribute to technical project success.,0.255091216
what is code refactoring and why is it important,Algorithm Engineer,We're hiring a Algorithm Engineer to support our technology goals and contribute to technical project success.,0.325179291
explain the role of git branching strategies like gitflow,Software Engineer,Contribute to the development of enterprise-level applications using modern software engineering principles and best practices.,0.355297034
what is git rebase and when would you use it,Backend Developer,Build robust systems that handle large-scale data and traffic with reliability and maintainability.,0.217125148
discuss the advantages of distributed version control systems,System Architect,We're hiring a System Architect to support our technology goals and contribute to technical project success.,0.361937012
describe the concept of microservices architecture,Algorithm Engineer,We're hiring a Algorithm Engineer to support our technology goals and contribute to technical project success.,0.267027174
what is a load balancer and why is it used in web applications,Frontend Developer,"We're hiring a Frontend Developer to craft responsive user interfaces using modern frameworks like React, Vue, or Angular.",0.291649583
explain the importance of caching in web applications,Full-Stack Developer,We're hiring a Full-Stack Developer to support our technology goals and contribute to technical project success.,0.385862503
what is a cdn content delivery network,Python Developer,We're hiring a Python Developer to support our technology goals and contribute to technical project success.,0.434709326
discuss the pros and cons of monolithic vs microservices architecture,Software Engineer,"Develop and maintain backend and frontend components in a collaborative environment, ensuring code quality and reusability.",0.233999731
what is a stateless vs stateful service,Software Engineer,Join our engineering team to design and implement reliable software systems with a focus on clean architecture and scalable code.,0.331331201
explain the concept of cap theorem in distributed systems,System Architect,We're hiring a System Architect to support our technology goals and contribute to technical project success.,0.480070266
how do you ensure data consistency in a distributed database,Full-Stack Developer,We're hiring a Full-Stack Developer to support our technology goals and contribute to technical project success.,0.310348335
describe the role of a reverse proxy in a web application,Backend Developer,"Develop APIs and server-side logic in a scalable and secure architecture using tools like Node.js, Django, or Spring Boot.",0.358149436
what is a message broker and when would you use one,Backend Developer,"Create and maintain backend infrastructure, RESTful APIs, and support data persistence layers.",0.420223044
what is sql injection and how can it be prevented,Backend Developer,"We're hiring a Backend Developer to manage application performance, system integration, and deployment pipelines.",0.44707244
explain the concept of crosssite scripting xss,Data Engineer,"Collaborate with analysts and scientists to provide clean, structured, and reliable data sources.",0.355452733
what is twofactor authentication 2fa,Data Engineer,Work on real-time and batch data systems using cloud-based platforms and modern data stacks.,0.281059573
describe the process of password hashing and salting,Security Engineer,We're hiring a Security Engineer to support our technology goals and contribute to technical project success.,0.374395251
what is oauth and how does it work,Security Engineer,We're hiring a Security Engineer to support our technology goals and contribute to technical project success.,0.330673208
how do you protect against session fixation attacks,System Architect,We're hiring a System Architect to support our technology goals and contribute to technical project success.,0.437401948
explain the principles of least privilege and defense in depth,Security Engineer,We're hiring a Security Engineer to support our technology goals and contribute to technical project success.,0.38484417
what is a ddos distributed denial of service attack,Security Engineer,We're hiring a Security Engineer to support our technology goals and contribute to technical project success.,0.293401148
how can you secure sensitive data in a mobile app,Data Engineer,"Collaborate with analysts and scientists to provide clean, structured, and reliable data sources.",0.267051413
discuss the importance of security in api design,Security Engineer,We're hiring a Security Engineer to support our technology goals and contribute to technical project success.,0.548827542
what is docker and how does it work,DevOps Engineer,Contribute to site reliability by building tooling and automation for efficient system operations.,0.295726111
explain the concept of container orchestration,DevOps Engineer,Help us maintain and scale our development toolchain and cloud-native services.,0.457063419
what is kubernetes and why is it popular in container management,DevOps Engineer,"We're looking for a DevOps Engineer to enhance cloud infrastructure, ensure system uptime, and monitor performance.",0.25280576
describe the process of continuous integration and continuous delivery cicd,Python Developer,We're hiring a Python Developer to support our technology goals and contribute to technical project success.,0.365538181
what is infrastructure as code iac,DevOps Engineer,"Design, automate, and manage CI/CD pipelines to streamline deployment across development and production environments.",0.425964375
how do you monitor the performance of a web application,Full-Stack Developer,We're hiring a Full-Stack Developer to support our technology goals and contribute to technical project success.,0.226579974
discuss the importance of automated testing in cicd pipelines,Quality Assurance (QA) Engineer,We're hiring a Quality Assurance (QA) Engineer to support our technology goals and contribute to technical project success.,0.363129143
what is bluegreen deployment and when would you use it,DevOps Engineer,Contribute to site reliability by building tooling and automation for efficient system operations.,0.388396236
explain the role of a configuration management tool like ansible,DevOps Engineer,Help us maintain and scale our development toolchain and cloud-native services.,0.241093805
describe the benefits of using a cloud platform like aws azure or google cloud,Security Engineer,We're hiring a Security Engineer to support our technology goals and contribute to technical project success.,0.233780776
explain the concept of closure in javascript,Full-Stack Developer,We're hiring a Full-Stack Developer to support our technology goals and contribute to technical project success.,0.317459829
describe the use of docker in a devops environment,DevOps Engineer,Contribute to site reliability by building tooling and automation for efficient system operations.,0.478969809
what is a race condition in software development,Software Engineer,Contribute to the development of enterprise-level applications using modern software engineering principles and best practices.,0.395097366
how would you optimize a websites load time,System Architect,We're hiring a System Architect to support our technology goals and contribute to technical project success.,0.219346942
what is the difference between sql and nosql databases,Backend Developer,"Work on microservices, caching, and data layer optimization to support a fast and reliable backend.",0.253952566
can you explain the concept of state in react,Object-Oriented Developer,We're hiring a Object-Oriented Developer to support our technology goals and contribute to technical project success.,0.248099395
what is continuous integration in devops,DevOps Engineer,Help us maintain and scale our development toolchain and cloud-native services.,0.49935448
how do you implement a binary search algorithm,Data Engineer,"We're hiring a Data Engineer to manage large-scale data ingestion, processing, and warehousing solutions.",0.287472326
describe the mvc architecture,Algorithm Engineer,We're hiring a Algorithm Engineer to support our technology goals and contribute to technical project success.,0.280639376
what are microservices and how do they differ from monolithic architectures,System Architect,We're hiring a System Architect to support our technology goals and contribute to technical project success.,0.268616985
explain the difference between and in javascript,Full-Stack Developer,We're hiring a Full-Stack Developer to support our technology goals and contribute to technical project success.,0.317459829
what is kubernetes and how does it relate to containerization,DevOps Engineer,"We're looking for a DevOps Engineer to enhance cloud infrastructure, ensure system uptime, and monitor performance.",0.347758275
describe how you would implement a restful api in a backend application,Backend Developer,"We're hiring a Backend Developer to manage application performance, system integration, and deployment pipelines.",0.346550098
what are the benefits of serverside rendering vs clientside rendering,Software Engineer,"We're looking for a Software Engineer skilled in problem-solving, debugging, and implementing robust features in production environments.",0.227514591
how do nosql databases handle data scaling compared to traditional sql databases,Data Engineer,"Collaborate with analysts and scientists to provide clean, structured, and reliable data sources.",0.399709997
explain the use of hooks in react,Frontend Developer,"As a Frontend Developer, you'll implement design systems, animations, and optimize page load times.",0.35113053
what is infrastructure as code iac and its significance in devops,DevOps Engineer,"We're looking for a DevOps Engineer to enhance cloud infrastructure, ensure system uptime, and monitor performance.",0.497184426
describe the process of memoization in programming,Data Engineer,"Join our team to design data pipelines and transform raw data into meaningful insights using tools like Spark, Airflow, and SQL.",0.381326989
what are the advantages of using a microservices architecture,Algorithm Engineer,We're hiring a Algorithm Engineer to support our technology goals and contribute to technical project success.,0.239287628
explain the solid principles in software engineering,Data Engineer,"We're hiring a Data Engineer to manage large-scale data ingestion, processing, and warehousing solutions.",0.316804006
what is lazy loading in web development,Software Engineer,"We're looking for a Software Engineer skilled in problem-solving, debugging, and implementing robust features in production environments.",0.284438579
discuss the role of a load balancer in a distributed system,System Architect,We're hiring a System Architect to support our technology goals and contribute to technical project success.,0.230302024
how does indexing improve database query performance,DevOps Engineer,Help us maintain and scale our development toolchain and cloud-native services.,0.353887469
explain event delegation in javascript,Frontend Developer,"We're hiring a Frontend Developer to craft responsive user interfaces using modern frameworks like React, Vue, or Angular.",0.408899529
explain the concept of closure in javascript,Full-Stack Developer,We're hiring a Full-Stack Developer to support our technology goals and contribute to technical project success.,0.317459829
describe the use of docker in a devops environment,DevOps Engineer,"We're looking for a DevOps Engineer to enhance cloud infrastructure, ensure system uptime, and monitor performance.",0.478969809
what is a race condition in software development,Software Engineer,"We're looking for a Software Engineer skilled in problem-solving, debugging, and implementing robust features in production environments.",0.395097366
how would you optimize a websites load time,System Architect,We're hiring a System Architect to support our technology goals and contribute to technical project success.,0.219346942
what is the difference between sql and nosql databases,Backend Developer,"Work on microservices, caching, and data layer optimization to support a fast and reliable backend.",0.253952566
can you explain the concept of state in react,Object-Oriented Developer,We're hiring a Object-Oriented Developer to support our technology goals and contribute to technical project success.,0.248099395
what is continuous integration in devops,DevOps Engineer,Help us maintain and scale our development toolchain and cloud-native services.,0.49935448
how do you implement a binary search algorithm,Data Engineer,"We're hiring a Data Engineer to manage large-scale data ingestion, processing, and warehousing solutions.",0.287472326
describe the mvc architecture,Algorithm Engineer,We're hiring a Algorithm Engineer to support our technology goals and contribute to technical project success.,0.280639376
what are microservices and how do they differ from monolithic architectures,System Architect,We're hiring a System Architect to support our technology goals and contribute to technical project success.,0.268616985
