Question,Job Title,Job Description,Similarity Score
what is a proper tail call,Software Engineer,Software Engineers at our company help build reliable and efficient systems through thoughtful design and collaborative implementation.,0
how do you check an object is a promise or not,Software Engineer,"As a Software Engineer, you'll develop, optimize, and support solutions tailored to our system architecture and business priorities.",0.300690424
how to detect if a function is called as constructor,Software Engineer,"This role as a Software Engineer involves ownership of functional features, performance goals, and scalable engineering practices.",0
what are the differences between arguments object and rest parameter,Backend Developer,"As a Backend Developer, you'll develop, optimize, and support solutions tailored to our system architecture and business priorities.",0.326433481
what are the differences between spread operator and rest parameter,Backend Developer,Join the team as a Backend Developer to solve technical problems and contribute to strategic system improvements.,0.42747405
what are the different kinds of generators,Software Engineer,The Software Engineer will be responsible for delivering value through technical solutions aligned with modern development practices.,0
what are the builtin iterables,Software Engineer,Software Engineers at our company help build reliable and efficient systems through thoughtful design and collaborative implementation.,0
what are the differences between forof and forin statements,Software Engineer,"As a Software Engineer, you'll develop, optimize, and support solutions tailored to our system architecture and business priorities.",0
how do you define instance and noninstance properties,Software Engineer,Join the team as a Software Engineer to solve technical problems and contribute to strategic system improvements.,0
what is the difference between isnan and numberisnan,Software Engineer,"This role as a Software Engineer involves ownership of functional features, performance goals, and scalable engineering practices.",0
how to invoke an iife without any extra brackets,Software Engineer,Join the team as a Software Engineer to solve technical problems and contribute to strategic system improvements.,0
is that possible to use expressions in switch cases,Quality Assurance (QA) Engineer,The Quality Assurance (QA) Engineer will be responsible for delivering value through technical solutions aligned with modern development practices.,0.274612197
what is the easiest way to ignore promise errors,Software Engineer,The Software Engineer will be responsible for delivering value through technical solutions aligned with modern development practices.,0
how do style the console output using css,Full-Stack Developer,Full-Stack Developers at our company help build reliable and efficient systems through thoughtful design and collaborative implementation.,0.228041607
what is nullish coalescing operator,Software Engineer,The Software Engineer will be responsible for delivering value through technical solutions aligned with modern development practices.,0
how do you group and nest console output,Software Engineer,Join the team as a Software Engineer to solve technical problems and contribute to strategic system improvements.,0
what is the difference between dense and sparse arrays,Data Engineer,Join the team as a Data Engineer to solve technical problems and contribute to strategic system improvements.,0.300460734
what are the different ways to create sparse arrays,Data Engineer,Join the team as a Data Engineer to solve technical problems and contribute to strategic system improvements.,0.269252089
what is the difference between settimeout setimmediate and processnexttick,Software Engineer,Join the team as a Software Engineer to solve technical problems and contribute to strategic system improvements.,0
how do you reverse an array without modifying original array,Backend Developer,The Backend Developer will be responsible for delivering value through technical solutions aligned with modern development practices.,0.406579429
how do you create custom html element,Frontend Developer,Frontend Developers at our company help build reliable and efficient systems through thoughtful design and collaborative implementation.,0.370325925
what is global execution context,System Architect,The System Architect will be responsible for delivering value through technical solutions aligned with modern development practices.,0.366424005
what is function execution context,Software Engineer,Software Engineers at our company help build reliable and efficient systems through thoughtful design and collaborative implementation.,0
what is debouncing,Software Engineer,"This role as a Software Engineer involves ownership of functional features, performance goals, and scalable engineering practices.",0
what is throttling,Software Engineer,"As a Software Engineer, you'll develop, optimize, and support solutions tailored to our system architecture and business priorities.",0
what is optional chaining,Software Engineer,"As a Software Engineer, you'll develop, optimize, and support solutions tailored to our system architecture and business priorities.",0
what is an environment record,Software Engineer,Join the team as a Software Engineer to solve technical problems and contribute to strategic system improvements.,0
how to verify if a variable is an array,Quality Assurance (QA) Engineer,Quality Assurance (QA) Engineers at our company help build reliable and efficient systems through thoughtful design and collaborative implementation.,0.302219337
what is pass by value and pass by reference,System Architect,"This role as a System Architect involves ownership of functional features, performance goals, and scalable engineering practices.",0.303696461
what are the differences between primitives and nonprimitives,Software Engineer,"This role as a Software Engineer involves ownership of functional features, performance goals, and scalable engineering practices.",0
what are hidden classes,Software Engineer,The Software Engineer will be responsible for delivering value through technical solutions aligned with modern development practices.,0.304791417
what is inline caching,Full-Stack Developer,Join the team as a Full-Stack Developer to solve technical problems and contribute to strategic system improvements.,0.327158266
how do you create your own bind method using either call or apply method,Full-Stack Developer,"This role as a Full-Stack Developer involves ownership of functional features, performance goals, and scalable engineering practices.",0.265444775
what are the differences between pure and impure functions,Data Engineer,"This role as a Data Engineer involves ownership of functional features, performance goals, and scalable engineering practices.",0.294776083
what is referential transparency,Software Engineer,"As a Software Engineer, you'll develop, optimize, and support solutions tailored to our system architecture and business priorities.",0
what are the possible sideeffects in javascript,Full-Stack Developer,The Full-Stack Developer will be responsible for delivering value through technical solutions aligned with modern development practices.,0.317459829
what are compose and pipe functions,Data Engineer,Data Engineers at our company help build reliable and efficient systems through thoughtful design and collaborative implementation.,0.294776083
what is module pattern,Software Engineer,Join the team as a Software Engineer to solve technical problems and contribute to strategic system improvements.,0
what is function composition,Software Engineer,Software Engineers at our company help build reliable and efficient systems through thoughtful design and collaborative implementation.,0
how to use await outside of async function prior to es2022,Backend Developer,Join the team as a Backend Developer to solve technical problems and contribute to strategic system improvements.,0.217125148
what is the purpose of the this keyword in javascript,Full-Stack Developer,"This role as a Full-Stack Developer involves ownership of functional features, performance goals, and scalable engineering practices.",0.317459829
why is java so popular,Backend Developer,Join the team as a Backend Developer to solve technical problems and contribute to strategic system improvements.,0.348398756
what is platform independence,Quality Assurance (QA) Engineer,"This role as a Quality Assurance (QA) Engineer involves ownership of functional features, performance goals, and scalable engineering practices.",0.420364416
what is bytecode,Software Engineer,Join the team as a Software Engineer to solve technical problems and contribute to strategic system improvements.,0
compare jdk vs jvm vs jre,Software Engineer,Software Engineers at our company help build reliable and efficient systems through thoughtful design and collaborative implementation.,0.331331201
what are the important differences between c and java,Backend Developer,Backend Developers at our company help build reliable and efficient systems through thoughtful design and collaborative implementation.,0.348398756
what is the role for a classloader in java,Backend Developer,"As a Backend Developer, you'll develop, optimize, and support solutions tailored to our system architecture and business priorities.",0.348398756
what are wrapper classes,Software Engineer,"This role as a Software Engineer involves ownership of functional features, performance goals, and scalable engineering practices.",0.304791417
why do we need wrapper classes in java,Backend Developer,"This role as a Backend Developer involves ownership of functional features, performance goals, and scalable engineering practices.",0.224708944
what are the different ways of creating wrapper class instances,Software Engineer,The Software Engineer will be responsible for delivering value through technical solutions aligned with modern development practices.,0
what are differences in the two ways of creating wrapper classes,Software Engineer,"This role as a Software Engineer involves ownership of functional features, performance goals, and scalable engineering practices.",0.304791417
what is auto boxing,Software Engineer,Join the team as a Software Engineer to solve technical problems and contribute to strategic system improvements.,0
what are the advantages of auto boxing,Software Engineer,"As a Software Engineer, you'll develop, optimize, and support solutions tailored to our system architecture and business priorities.",0
what is casting,Software Engineer,The Software Engineer will be responsible for delivering value through technical solutions aligned with modern development practices.,0
what is implicit casting,Software Engineer,Software Engineers at our company help build reliable and efficient systems through thoughtful design and collaborative implementation.,0
what is explicit casting,Software Engineer,"This role as a Software Engineer involves ownership of functional features, performance goals, and scalable engineering practices.",0
are all strings immutable,Software Engineer,"This role as a Software Engineer involves ownership of functional features, performance goals, and scalable engineering practices.",0
where are string values stored in memory,Backend Developer,"As a Backend Developer, you'll develop, optimize, and support solutions tailored to our system architecture and business priorities.",0.307158729
why should you be careful about string concatenation operator in loops,Software Engineer,"As a Software Engineer, you'll develop, optimize, and support solutions tailored to our system architecture and business priorities.",0
how do you solve above problem,Software Engineer,Join the team as a Software Engineer to solve technical problems and contribute to strategic system improvements.,0.304791417
what are differences between string and stringbuffer,Software Engineer,"This role as a Software Engineer involves ownership of functional features, performance goals, and scalable engineering practices.",0
what are differences between stringbuilder and stringbuffer,Software Engineer,"As a Software Engineer, you'll develop, optimize, and support solutions tailored to our system architecture and business priorities.",0
can you give examples of different utility methods in string class,Quality Assurance (QA) Engineer,"As a Quality Assurance (QA) Engineer, you'll develop, optimize, and support solutions tailored to our system architecture and business priorities.",0.336842809
what is a class,Software Engineer,The Software Engineer will be responsible for delivering value through technical solutions aligned with modern development practices.,0
what is an object,Software Engineer,"This role as a Software Engineer involves ownership of functional features, performance goals, and scalable engineering practices.",0.300690424
what is state of an object,Software Engineer,The Software Engineer will be responsible for delivering value through technical solutions aligned with modern development practices.,0.246131955
what is behavior of an object,Software Engineer,Join the team as a Software Engineer to solve technical problems and contribute to strategic system improvements.,0.300690424
what is the super class of every class in java,Backend Developer,Backend Developers at our company help build reliable and efficient systems through thoughtful design and collaborative implementation.,0.348398756
explain about tostring method,Software Engineer,Software Engineers at our company help build reliable and efficient systems through thoughtful design and collaborative implementation.,0
what is the use of equals method in java,Full-Stack Developer,"This role as a Full-Stack Developer involves ownership of functional features, performance goals, and scalable engineering practices.",0.33713631
what are the important things to consider when implementing equals method,Software Engineer,"This role as a Software Engineer involves ownership of functional features, performance goals, and scalable engineering practices.",0.277127121
what is the hashcode method used for in java,Backend Developer,The Backend Developer will be responsible for delivering value through technical solutions aligned with modern development practices.,0.348398756
explain inheritance with examples,Software Engineer,"As a Software Engineer, you'll develop, optimize, and support solutions tailored to our system architecture and business priorities.",0
what is method overloading,Software Engineer,Join the team as a Software Engineer to solve technical problems and contribute to strategic system improvements.,0
what is method overriding,Software Engineer,"This role as a Software Engineer involves ownership of functional features, performance goals, and scalable engineering practices.",0
can super class reference variable can hold an object of sub class,Software Engineer,"As a Software Engineer, you'll develop, optimize, and support solutions tailored to our system architecture and business priorities.",0.300690424
is multiple inheritance allowed in java,Backend Developer,Backend Developers at our company help build reliable and efficient systems through thoughtful design and collaborative implementation.,0.348398756
what is an interface,Software Engineer,"As a Software Engineer, you'll develop, optimize, and support solutions tailored to our system architecture and business priorities.",0
how do you define an interface,Software Engineer,"As a Software Engineer, you'll develop, optimize, and support solutions tailored to our system architecture and business priorities.",0
how do you implement an interface,Backend Developer,Join the team as a Backend Developer to solve technical problems and contribute to strategic system improvements.,0.184507608
can you explain a few tricky things about interfaces,Software Engineer,"As a Software Engineer, you'll develop, optimize, and support solutions tailored to our system architecture and business priorities.",0.282132469
can you extend an interface,Software Engineer,"This role as a Software Engineer involves ownership of functional features, performance goals, and scalable engineering practices.",0
can a class extend multiple interfaces,Software Engineer,The Software Engineer will be responsible for delivering value through technical solutions aligned with modern development practices.,0.282132469
what is an abstract class,Software Engineer,"This role as a Software Engineer involves ownership of functional features, performance goals, and scalable engineering practices.",0.304791417
when do you use an abstract class,Software Engineer,"As a Software Engineer, you'll develop, optimize, and support solutions tailored to our system architecture and business priorities.",0.276949323
how do you define an abstract method,Software Engineer,Join the team as a Software Engineer to solve technical problems and contribute to strategic system improvements.,0.304791417
compare abstract class vs interface,Software Engineer,The Software Engineer will be responsible for delivering value through technical solutions aligned with modern development practices.,0.258235026
what is a constructor,Software Engineer,The Software Engineer will be responsible for delivering value through technical solutions aligned with modern development practices.,0
what is a default constructor,Software Engineer,Join the team as a Software Engineer to solve technical problems and contribute to strategic system improvements.,0
how do you call a super class constructor from a constructor,Software Engineer,The Software Engineer will be responsible for delivering value through technical solutions aligned with modern development practices.,0
can a constructor be called directly from a method,Software Engineer,"As a Software Engineer, you'll develop, optimize, and support solutions tailored to our system architecture and business priorities.",0
is a super class constructor called even when there is no explicit call from a sub class constructor,Software Engineer,"As a Software Engineer, you'll develop, optimize, and support solutions tailored to our system architecture and business priorities.",0
what is polymorphism,Software Engineer,Join the team as a Software Engineer to solve technical problems and contribute to strategic system improvements.,0.302373554
what is the use of instanceof operator in java,Full-Stack Developer,The Full-Stack Developer will be responsible for delivering value through technical solutions aligned with modern development practices.,0.33713631
what is coupling,Software Engineer,Software Engineers at our company help build reliable and efficient systems through thoughtful design and collaborative implementation.,0
what is cohesion,Software Engineer,"As a Software Engineer, you'll develop, optimize, and support solutions tailored to our system architecture and business priorities.",0
what is encapsulation,Software Engineer,The Software Engineer will be responsible for delivering value through technical solutions aligned with modern development practices.,0.33413036
what is an inner class,Software Engineer,"As a Software Engineer, you'll develop, optimize, and support solutions tailored to our system architecture and business priorities.",0
what is a static inner class,Software Engineer,"As a Software Engineer, you'll develop, optimize, and support solutions tailored to our system architecture and business priorities.",0
can you create an inner class inside a method,Frontend Developer,Join the team as a Frontend Developer to solve technical problems and contribute to strategic system improvements.,0.195069816
what is an anonymous class,Software Engineer,Software Engineers at our company help build reliable and efficient systems through thoughtful design and collaborative implementation.,0
what is default class modifier,Software Engineer,Join the team as a Software Engineer to solve technical problems and contribute to strategic system improvements.,0
what is private access modifier,Software Engineer,"As a Software Engineer, you'll develop, optimize, and support solutions tailored to our system architecture and business priorities.",0
what is default or package access modifier,Software Engineer,Software Engineers at our company help build reliable and efficient systems through thoughtful design and collaborative implementation.,0
what is protected access modifier,Software Engineer,"As a Software Engineer, you'll develop, optimize, and support solutions tailored to our system architecture and business priorities.",0
what is public access modifier,Software Engineer,"As a Software Engineer, you'll develop, optimize, and support solutions tailored to our system architecture and business priorities.",0
what access types of variables can be accessed from a class in same package,Quality Assurance (QA) Engineer,Join the team as a Quality Assurance (QA) Engineer to solve technical problems and contribute to strategic system improvements.,0.345214945
what access types of variables can be accessed from a class in different package,Quality Assurance (QA) Engineer,The Quality Assurance (QA) Engineer will be responsible for delivering value through technical solutions aligned with modern development practices.,0.345214945
what access types of variables can be accessed from a sub class in same package,Quality Assurance (QA) Engineer,Join the team as a Quality Assurance (QA) Engineer to solve technical problems and contribute to strategic system improvements.,0.345214945
what access types of variables can be accessed from a sub class in different package,Quality Assurance (QA) Engineer,Quality Assurance (QA) Engineers at our company help build reliable and efficient systems through thoughtful design and collaborative implementation.,0.345214945
what is the use of a final modifier on a class,Backend Developer,Backend Developers at our company help build reliable and efficient systems through thoughtful design and collaborative implementation.,0.217125148
what is the use of a final modifier on a method,Backend Developer,Backend Developers at our company help build reliable and efficient systems through thoughtful design and collaborative implementation.,0.217125148
what is a final variable,Software Engineer,The Software Engineer will be responsible for delivering value through technical solutions aligned with modern development practices.,0
what is a final argument,Software Engineer,Join the team as a Software Engineer to solve technical problems and contribute to strategic system improvements.,0
what happens when a variable is marked as volatile,Software Engineer,"This role as a Software Engineer involves ownership of functional features, performance goals, and scalable engineering practices.",0
what is a static variable,Software Engineer,"This role as a Software Engineer involves ownership of functional features, performance goals, and scalable engineering practices.",0
why should you always use blocks around if statement,Backend Developer,Join the team as a Backend Developer to solve technical problems and contribute to strategic system improvements.,0.217125148
should default be the last case in a switch statement,Software Engineer,"This role as a Software Engineer involves ownership of functional features, performance goals, and scalable engineering practices.",0
can a switch statement be used around a string,Software Engineer,Join the team as a Software Engineer to solve technical problems and contribute to strategic system improvements.,0
what is an enhanced for loop,Software Engineer,The Software Engineer will be responsible for delivering value through technical solutions aligned with modern development practices.,0
why is exception handling important,Backend Developer,Backend Developers at our company help build reliable and efficient systems through thoughtful design and collaborative implementation.,0.283462078
what design pattern is used to implement exception handling features in most languages,Backend Developer,Join the team as a Backend Developer to solve technical problems and contribute to strategic system improvements.,0.220261637
what is the need for finally block,Full-Stack Developer,Full-Stack Developers at our company help build reliable and efficient systems through thoughtful design and collaborative implementation.,0.216846957
in what scenarios is code in finally not executed,Algorithm Engineer,The Algorithm Engineer will be responsible for delivering value through technical solutions aligned with modern development practices.,0.325179291
will finally be executed in the program below,Software Engineer,Join the team as a Software Engineer to solve technical problems and contribute to strategic system improvements.,0
is try without a catch is allowed,Software Engineer,Join the team as a Software Engineer to solve technical problems and contribute to strategic system improvements.,0
is try without catch and finally allowed,Software Engineer,Join the team as a Software Engineer to solve technical problems and contribute to strategic system improvements.,0
can you explain the hierarchy of exception handling classes,Software Engineer,"As a Software Engineer, you'll develop, optimize, and support solutions tailored to our system architecture and business priorities.",0.242376616
what is the difference between error and exception,Software Engineer,Software Engineers at our company help build reliable and efficient systems through thoughtful design and collaborative implementation.,0
what is the difference between checked exceptions and unchecked exceptions,Software Engineer,"As a Software Engineer, you'll develop, optimize, and support solutions tailored to our system architecture and business priorities.",0
how do you throw an exception from a method,Software Engineer,Join the team as a Software Engineer to solve technical problems and contribute to strategic system improvements.,0
