Question,Job Title,Job Description,Similarity Score
how do you monitor the performance of a web application,Full-Stack Developer,"The Full-Stack Developer role involves contributing to system architecture, development, and operational excellence.",0.226579974
discuss the importance of automated testing in cicd pipelines,Quality Assurance (QA) Engineer,"Contribute to the design of scalable QA strategies, from exploratory testing to continuous integration pipelines.",0.363129143
what is bluegreen deployment and when would you use it,DevOps Engineer,"As a DevOps Engineer, your work will support scalable solutions and high-quality deliverables.",0.388396236
explain the role of a configuration management tool like ansible,DevOps Engineer,"As a DevOps Engineer, your work will support scalable solutions and high-quality deliverables.",0.241093805
describe the benefits of using a cloud platform like aws azure or google cloud,Security Engineer,"The Security Engineer role involves contributing to system architecture, development, and operational excellence.",0.233780776
explain the concept of closure in javascript,Full-Stack Developer,"The Full-Stack Developer role involves contributing to system architecture, development, and operational excellence.",0.317459829
describe the use of docker in a devops environment,DevOps Engineer,"The DevOps Engineer role involves contributing to system architecture, development, and operational excellence.",0.478969809
what is a race condition in software development,Software Engineer,"Build and maintain reliable software systems while applying principles of clean code, testing, and reusability.",0.395097366
how would you optimize a websites load time,System Architect,"The System Architect role involves contributing to system architecture, development, and operational excellence.",0.219346942
what is the difference between sql and nosql databases,Backend Developer,"Implement secure backend features with attention to data integrity, authentication, and resilience.",0.253952566
can you explain the concept of state in react,Object-Oriented Developer,"As a Object-Oriented Developer, your work will support scalable solutions and high-quality deliverables.",0.248099395
what is continuous integration in devops,DevOps Engineer,"As a DevOps Engineer, your work will support scalable solutions and high-quality deliverables.",0.49935448
how do you implement a binary search algorithm,Data Engineer,"Collaborate with stakeholders to define data schemas, optimize storage, and deliver trusted datasets.",0.287472326
describe the mvc architecture,Algorithm Engineer,"The Algorithm Engineer role involves contributing to system architecture, development, and operational excellence.",0.280639376
what are microservices and how do they differ from monolithic architectures,System Architect,"As a System Architect, your work will support scalable solutions and high-quality deliverables.",0.268616985
explain the difference between and in javascript,Full-Stack Developer,"The Full-Stack Developer role involves contributing to system architecture, development, and operational excellence.",0.317459829
what is kubernetes and how does it relate to containerization,DevOps Engineer,"As a DevOps Engineer, your work will support scalable solutions and high-quality deliverables.",0.347758275
describe how you would implement a restful api in a backend application,Backend Developer,Write robust server-side logic to support product functionality and integrate with external services.,0.346550098
what are the benefits of serverside rendering vs clientside rendering,Software Engineer,Collaborate with cross-functional teams to implement product features using modern software practices.,0.227514591
how do nosql databases handle data scaling compared to traditional sql databases,Data Engineer,Ensure data quality and integrity by implementing validation frameworks and monitoring systems.,0.399709997
explain the use of hooks in react,Frontend Developer,"The Frontend Developer role involves contributing to system architecture, development, and operational excellence.",0.35113053
what is infrastructure as code iac and its significance in devops,DevOps Engineer,"The DevOps Engineer role involves contributing to system architecture, development, and operational excellence.",0.497184426
describe the process of memoization in programming,Data Engineer,Ensure data quality and integrity by implementing validation frameworks and monitoring systems.,0.381326989
what are the advantages of using a microservices architecture,Algorithm Engineer,"As a Algorithm Engineer, your work will support scalable solutions and high-quality deliverables.",0.239287628
explain the solid principles in software engineering,Data Engineer,Integrate APIs and automate data ingestion processes for scalable and reproducible pipelines.,0.316804006
what is lazy loading in web development,Software Engineer,Apply object-oriented programming and design patterns to solve technical problems across the stack.,0.284438579
discuss the role of a load balancer in a distributed system,System Architect,"The System Architect role involves contributing to system architecture, development, and operational excellence.",0.230302024
how does indexing improve database query performance,DevOps Engineer,"The DevOps Engineer role involves contributing to system architecture, development, and operational excellence.",0.353887469
explain event delegation in javascript,Frontend Developer,"The Frontend Developer role involves contributing to system architecture, development, and operational excellence.",0.408899529
explain the concept of closure in javascript,Full-Stack Developer,"As a Full-Stack Developer, your work will support scalable solutions and high-quality deliverables.",0.317459829
describe the use of docker in a devops environment,DevOps Engineer,"The DevOps Engineer role involves contributing to system architecture, development, and operational excellence.",0.478969809
what is a race condition in software development,Software Engineer,Collaborate with cross-functional teams to implement product features using modern software practices.,0.395097366
how would you optimize a websites load time,System Architect,"The System Architect role involves contributing to system architecture, development, and operational excellence.",0.219346942
what is the difference between sql and nosql databases,Backend Developer,"Design and maintain scalable backend services, APIs, and databases optimized for performance and availability.",0.253952566
can you explain the concept of state in react,Object-Oriented Developer,"As a Object-Oriented Developer, your work will support scalable solutions and high-quality deliverables.",0.248099395
what is continuous integration in devops,DevOps Engineer,"The DevOps Engineer role involves contributing to system architecture, development, and operational excellence.",0.49935448
how do you implement a binary search algorithm,Data Engineer,"Design ETL workflows to extract, transform, and load data for analytics, reporting, and modeling.",0.287472326
describe the mvc architecture,Algorithm Engineer,"As a Algorithm Engineer, your work will support scalable solutions and high-quality deliverables.",0.280639376
what are microservices and how do they differ from monolithic architectures,System Architect,"The System Architect role involves contributing to system architecture, development, and operational excellence.",0.268616985
explain the difference between and in javascript,Full-Stack Developer,"The Full-Stack Developer role involves contributing to system architecture, development, and operational excellence.",0.317459829
what is kubernetes and how does it relate to containerization,DevOps Engineer,"As a DevOps Engineer, your work will support scalable solutions and high-quality deliverables.",0.347758275
describe how you would implement a restful api in a backend application,Backend Developer,"Implement secure backend features with attention to data integrity, authentication, and resilience.",0.346550098
what are the benefits of serverside rendering vs clientside rendering,Software Engineer,"Build and maintain reliable software systems while applying principles of clean code, testing, and reusability.",0.227514591
how do nosql databases handle data scaling compared to traditional sql databases,Data Engineer,Integrate APIs and automate data ingestion processes for scalable and reproducible pipelines.,0.399709997
explain the use of hooks in react,Frontend Developer,"As a Frontend Developer, your work will support scalable solutions and high-quality deliverables.",0.35113053
what is infrastructure as code iac and its significance in devops,DevOps Engineer,"The DevOps Engineer role involves contributing to system architecture, development, and operational excellence.",0.497184426
describe the process of memoization in programming,Data Engineer,Integrate APIs and automate data ingestion processes for scalable and reproducible pipelines.,0.381326989
what are the advantages of using a microservices architecture,Algorithm Engineer,"The Algorithm Engineer role involves contributing to system architecture, development, and operational excellence.",0.239287628
explain the solid principles in software engineering,Data Engineer,Build and maintain robust data pipelines for batch and streaming use cases using modern data platforms.,0.316804006
what is lazy loading in web development,Software Engineer,"Deliver full lifecycle software development with a focus on modular design, maintainability, and performance.",0.284438579
discuss the role of a load balancer in a distributed system,System Architect,"As a System Architect, your work will support scalable solutions and high-quality deliverables.",0.230302024
how does indexing improve database query performance,DevOps Engineer,"The DevOps Engineer role involves contributing to system architecture, development, and operational excellence.",0.353887469
explain event delegation in javascript,Frontend Developer,"The Frontend Developer role involves contributing to system architecture, development, and operational excellence.",0.408899529
explain the concept of closure in javascript,Full-Stack Developer,"The Full-Stack Developer role involves contributing to system architecture, development, and operational excellence.",0.317459829
describe the use of docker in a devops environment,DevOps Engineer,"As a DevOps Engineer, your work will support scalable solutions and high-quality deliverables.",0.478969809
design a distributed keyvalue store,System Architect,"The System Architect role involves contributing to system architecture, development, and operational excellence.",0.358469932
implement a function to check if a binary tree is balanced,Data Engineer,Ensure data quality and integrity by implementing validation frameworks and monitoring systems.,0.362429007
design a url shortening service like bitly,Software Engineer,"Deliver full lifecycle software development with a focus on modular design, maintainability, and performance.",0.394784643
design a recommendation system for a large ecommerce platform,Quality Assurance (QA) Engineer,"Collaborate with developers to understand requirements, define edge cases, and improve test coverage.",0.300461302
write an algorithm to find the median of a stream of numbers,Quality Assurance (QA) Engineer,"Participate in release cycles by validating builds, reporting issues, and monitoring defect resolution.",0.294746883
explain the raft consensus algorithm,System Architect,"As a System Architect, your work will support scalable solutions and high-quality deliverables.",0.491762612
optimize a global hightraffic content delivery network,Python Developer,"The Python Developer role involves contributing to system architecture, development, and operational excellence.",0.300307718
design a chat application that can scale to millions of users,System Architect,"The System Architect role involves contributing to system architecture, development, and operational excellence.",0.258680161
implement a garbage collector for a programming language,Data Engineer,"Design ETL workflows to extract, transform, and load data for analytics, reporting, and modeling.",0.490745552
design a scalable notification system for a social network,System Architect,"As a System Architect, your work will support scalable solutions and high-quality deliverables.",0.292672016
explain the workings of the tcp protocol for a lowlatency network,System Architect,"As a System Architect, your work will support scalable solutions and high-quality deliverables.",0.340553438
design and implement a concurrent hash map,Data Engineer,Integrate APIs and automate data ingestion processes for scalable and reproducible pipelines.,0.364020978
find the kth largest element in a stream of numbers,Software Engineer,"Participate in code reviews, system design sessions, and the continuous improvement of engineering standards.",0
implement googles pagerank algorithm,Backend Developer,"Optimize backend architecture for latency, throughput, and fault tolerance in distributed systems.",0.184507608
design an api rate limiter for a web service,System Architect,"As a System Architect, your work will support scalable solutions and high-quality deliverables.",0.392011534
optimize database queries for a hightraffic website,Full-Stack Developer,"As a Full-Stack Developer, your work will support scalable solutions and high-quality deliverables.",0.500382739
create a secure and scalable authentication system for a web application,Security Engineer,"The Security Engineer role involves contributing to system architecture, development, and operational excellence.",0.315750204
design a system for efficient storage and retrieval of largescale timeseries data,System Architect,"The System Architect role involves contributing to system architecture, development, and operational excellence.",0.511827735
explain how a blockchain works and how to implement one,System Architect,"The System Architect role involves contributing to system architecture, development, and operational excellence.",0.387481919
design an efficient parking lot management system,System Architect,"The System Architect role involves contributing to system architecture, development, and operational excellence.",0.421995683
develop a machine learning model to predict stock prices,Machine Learning Engineer,"The Machine Learning Engineer role involves contributing to system architecture, development, and operational excellence.",0.377355548
write a custom memory allocator for a c application,Quality Assurance (QA) Engineer,"Participate in release cycles by validating builds, reporting issues, and monitoring defect resolution.",0.241969202
design a realtime multiplayer online game architecture,System Architect,"As a System Architect, your work will support scalable solutions and high-quality deliverables.",0.309995571
implement a distributed file system,System Architect,"As a System Architect, your work will support scalable solutions and high-quality deliverables.",0.306204497
optimize a search algorithm for a large dataset in a distributed environment,System Architect,"The System Architect role involves contributing to system architecture, development, and operational excellence.",0.230424191
design a data pipeline for processing big data in realtime,Data Engineer,"Design ETL workflows to extract, transform, and load data for analytics, reporting, and modeling.",0.46775493
build a highfrequency trading system and discuss its components,System Architect,"The System Architect role involves contributing to system architecture, development, and operational excellence.",0.241957479
develop a deep learning model to analyze and interpret medical images,System Architect,"As a System Architect, your work will support scalable solutions and high-quality deliverables.",0.345431255
create an ai that can play a complex board game at a competitive level,System Architect,"The System Architect role involves contributing to system architecture, development, and operational excellence.",0.266149144
design a fraud detection system for online transactions,Backend Developer,Contribute to backend codebases that enable seamless cross-service communication and data processing.,0.321756045
implement a distributed graph processing framework,System Architect,"As a System Architect, your work will support scalable solutions and high-quality deliverables.",0.583499428
design a global video streaming service like netflix,System Architect,"As a System Architect, your work will support scalable solutions and high-quality deliverables.",0.317615631
create a system to efficiently match job seekers with job postings,Frontend Developer,"As a Frontend Developer, your work will support scalable solutions and high-quality deliverables.",0.195069816
design and implement a largescale distributed cache system,System Architect,"As a System Architect, your work will support scalable solutions and high-quality deliverables.",0.323763953
optimize network protocols for a satellite communication system,System Architect,"The System Architect role involves contributing to system architecture, development, and operational excellence.",0.283926538
develop an autonomous vehicles path planning algorithm,System Architect,"The System Architect role involves contributing to system architecture, development, and operational excellence.",0.328255646
design a scalable and reliable messaging system for a large corporation,System Architect,"The System Architect role involves contributing to system architecture, development, and operational excellence.",0.297667435
implement a natural language processing algorithm to understand and answer user queries,Frontend Developer,"As a Frontend Developer, your work will support scalable solutions and high-quality deliverables.",0.330582627
create an efficient algorithm for realtime anomaly detection in network traffic,Machine Learning Engineer,"As a Machine Learning Engineer, your work will support scalable solutions and high-quality deliverables.",0.424188555
design a system to manage and process internet of things iot data,System Architect,"The System Architect role involves contributing to system architecture, development, and operational excellence.",0.483257
build a compiler for a new programming language,Data Engineer,Ensure data quality and integrity by implementing validation frameworks and monitoring systems.,0.433224298
implement a robust text editor with features like autocomplete and syntax highlighting,Software Engineer,Collaborate with cross-functional teams to implement product features using modern software practices.,0.271038361
design a scalable infrastructure for an online advertising platform,Quality Assurance (QA) Engineer,"Develop and execute test plans, write automated scripts, and ensure high product quality across deployments.",0.317302723
develop a machine learning algorithm to detect fake news on social media,System Architect,"The System Architect role involves contributing to system architecture, development, and operational excellence.",0.300597978
optimize an sql database for a highvolume financial transaction system,Full-Stack Developer,"The Full-Stack Developer role involves contributing to system architecture, development, and operational excellence.",0.314665307
design a cloudbased virtual desktop infrastructure,System Architect,"As a System Architect, your work will support scalable solutions and high-quality deliverables.",0.320913404
create a realtime sports analytics system using sensor data,System Architect,"The System Architect role involves contributing to system architecture, development, and operational excellence.",0.361597807
implement a quantum algorithm for solving a wellknown computational problem,Backend Developer,"Optimize backend architecture for latency, throughput, and fault tolerance in distributed systems.",0.184507608
design a secure mobile payment system for developing countries,Security Engineer,"The Security Engineer role involves contributing to system architecture, development, and operational excellence.",0.400792629
build a scalable image processing pipeline for a photosharing app,System Architect,"As a System Architect, your work will support scalable solutions and high-quality deliverables.",0.390952412
compilation translates source code into machine code creating an executable file interpretation translates and executes code line by line without an executable,Algorithm Engineer,"The Algorithm Engineer role involves contributing to system architecture, development, and operational excellence.",0.290187044
explain the concept of polymorphism,Software Engineer,"Deliver full lifecycle software development with a focus on modular design, maintainability, and performance.",0.302373554
define encapsulation and give an example,Software Engineer,Apply object-oriented programming and design patterns to solve technical problems across the stack.,0.33413036
what is an abstract class and how is it different from an interface,Software Engineer,"Deliver full lifecycle software development with a focus on modular design, maintainability, and performance.",0.304791417
describe the principles of objectoriented programming oop,Software Engineer,Apply object-oriented programming and design patterns to solve technical problems across the stack.,0.336024943
what is the purpose of a constructor,Software Engineer,"Participate in code reviews, system design sessions, and the continuous improvement of engineering standards.",0
explain the difference between stack and heap memory,Software Engineer,Apply object-oriented programming and design patterns to solve technical problems across the stack.,0.315813371
what is a design pattern and can you name a few,Frontend Developer,"As a Frontend Developer, your work will support scalable solutions and high-quality deliverables.",0.337115178
define the term dry in software development,Software Engineer,"Participate in code reviews, system design sessions, and the continuous improvement of engineering standards.",0.382761279
what is the solid principle,Software Engineer,"Build and maintain reliable software systems while applying principles of clean code, testing, and reusability.",0.304513616
what is the difference between an array and a linked list,System Architect,"The System Architect role involves contributing to system architecture, development, and operational excellence.",0.357429194
explain the time complexity of an algorithm,Data Engineer,Ensure data quality and integrity by implementing validation frameworks and monitoring systems.,0.470329255
describe the difference between a binary search tree and a hash table,Data Engineer,"Design ETL workflows to extract, transform, and load data for analytics, reporting, and modeling.",0.271017163
what is a linked list and how does it work,System Architect,"As a System Architect, your work will support scalable solutions and high-quality deliverables.",0.325421002
explain the concept of recursion,Algorithm Engineer,"The Algorithm Engineer role involves contributing to system architecture, development, and operational excellence.",0.364114786
what is big o notation and why is it important,Data Engineer,Ensure data quality and integrity by implementing validation frameworks and monitoring systems.,0.292967023
how do you perform a binary search on a sorted array,Data Engineer,"Design ETL workflows to extract, transform, and load data for analytics, reporting, and modeling.",0.24593783
discuss the advantages and disadvantages of different sorting algorithms,Data Engineer,"Design ETL workflows to extract, transform, and load data for analytics, reporting, and modeling.",0.467626962
explain how a hash table works,Data Engineer,"Collaborate with stakeholders to define data schemas, optimize storage, and deliver trusted datasets.",0.272484142
what is dynamic programming,Data Engineer,"Design ETL workflows to extract, transform, and load data for analytics, reporting, and modeling.",0.523420087
what is the difference between java and javascript,Backend Developer,"Implement secure backend features with attention to data integrity, authentication, and resilience.",0.275945762
describe the mvc architectural pattern,System Architect,"As a System Architect, your work will support scalable solutions and high-quality deliverables.",0.31235799
what is a restful api,Backend Developer,"Optimize backend architecture for latency, throughput, and fault tolerance in distributed systems.",0.274980579
explain the use of this keyword in javascript,Frontend Developer,"The Frontend Developer role involves contributing to system architecture, development, and operational excellence.",0.308266822
what is a closure in programming,Data Engineer,"Collaborate with stakeholders to define data schemas, optimize storage, and deliver trusted datasets.",0.46269921
what are the differences between python 2 and python 3,Backend Developer,Contribute to backend codebases that enable seamless cross-service communication and data processing.,0.353598373
discuss the role of a package manager like npm or pip,Software Engineer,"Participate in code reviews, system design sessions, and the continuous improvement of engineering standards.",0.355297034
explain the concept of multithreading in java,Backend Developer,Contribute to backend codebases that enable seamless cross-service communication and data processing.,0.260843764
what is a singleton pattern,Backend Developer,Write robust server-side logic to support product functionality and integrate with external services.,0.303976867
what is a virtual function in c,System Architect,"As a System Architect, your work will support scalable solutions and high-quality deliverables.",0.36557571
